74,Male,21-23,Nursing,Undergraduate,Nigeria ,Yes,Yes,For academic research purposes ,Yes,Sometimes,Yes,Sometimes,Yes,Very effective,In typical example where it helped  to analyze as exactly as being taught ,Slightly dependent,In cases where i couldn't find the material in school library  then i rely toward it ,Yes,Yes,I suggest they analyze task given too easy to understand. I. E creating a precise answer rather than being dynamic with them 
75,Female,18-20,Pharmacy,Undergraduate,Nigeria,Yes,Yes,I ask questions on topics I don't understand ,Yes,Sometimes,Yes,Sometimes,Yes,Moderately effective,Like in physics I wanted to answer a question on pendulum and it explained taught about compound pendulum that I didn't know existed ,Slightly dependent,When I am faced with difficulty on a topic ,No,Yes,I feel that it should explain the topics extensively 
76,Male,18-20,Medicine And Surgery,Undergraduate,Nigeria ,Yes,Yes,Research and study ,Yes,Often,Yes,Sometimes,Depending on the assignment,Very effective,Dangers of alcohol ,Slightly dependent,Research ,No,Yes,Improving Accuracy 
77,Female,18-20,Medical Radiography,Undergraduate,Nigeria ,Yes,Yes,Simplifying complicated texts ,Yes,Always,Yes,Always,Yes,Very effective,Exams,Highly dependent,Mainly school wotk,No,Yes,Making the answers specific 
78,Female,21-23,Pharmacy,Undergraduate,Nigeria ,Yes,Yes,Assignment ,Yes,Always,Yes,Always,Yes,Moderately effective,Assignment ,Moderately dependent,Learning ,Yes,Yes,It helps in learning 
79,Female,18-20,History And International Relations,Undergraduate,Nigeria ,Yes,Yes,"For research, assignments, presentations etc",Yes,Often,Yes,Often,Depending on the assignment,Very effective,When I needed to understand the Marxist theory for a presentation.,Highly dependent,For almost everything ,Yes,Yes,Teacher and lecturers should allow it.
80,Male,18-20,Software Engineering,Undergraduate,Nigeria ,Yes,Yes,Mostly in assignments and research ,Yes,Often,Yes,Often,Yes,Very effective,It helped explain binomial theorem in my last math revision for an exam,Slightly dependent,"Explanations, assignments, revisions ",Yes,Yes,I'd prefer if they could explain more in detail 
81,Male,18-20,Anatomy,Undergraduate,Nigeria ,Yes,Yes,Easy and effective learning ,Yes,Always,No,Sometimes,Depending on the assignment,Extremely effective,Gross anatomy ,Moderately dependent,I don't feel much dependent on ai,No,Yes,I do not know
82,Male,24-26,Mass Communication,Undergraduate,Nigeria ,Yes,Yes,Creating content ideas ,Yes,Always,Yes,Always,Depending on the assignment,Extremely effective,"Meta ai, Sonic, chatgpt",Completely dependent,They are my besties,No,Yes,"In making notes, students can get materials from AI. "
83,Male,21-23,IT & BIS,Undergraduate,United Kingdom,Yes,Yes,I make use of AI in breaking down and explaining complex topics and also for my personalized learning.,Yes,Always,Yes,Often,Yes,Extremely effective,"AI tools like ChatGPT, Deep Seek and Copilot have helped me grasp complex topics by breaking them down into simpler terms. For example, when studying database normalization, AI explained the differences between 1NF, 2NF, and 3NF with real-world examples, making it easier to understand.",Moderately dependent,"I use AI for quick explanations, brainstorming ideas, summarizing content, and generating code snippets. However, I balance it with critical thinking and traditional learning methods to avoid over-reliance.",Yes,Yes,"AI should integrate with lesson plans, helping teachers enhance their teaching rather than replace them."
84,Male,21-23,Software Engineering,Undergraduate,United Kingdom,Yes,Yes,"I use them to conduct research, and engage in insightful about relevant topics",Yes,Often,Yes,Often,Yes,Very effective,"In cryptography, I had time understanding the online articles out there about merkle trees, but with the help of AI, which was able to break it down to a very basic level, made me understand it much more quickly",Moderately dependent,I rely on them to help explaining completely new concepts,Yes,Yes,I do not know
85,Female,21-23,IT & BIS,Undergraduate,United Kingdom,Yes,Yes,Search difficult questions ,Yes,Sometimes,Yes,Sometimes,Yes,Very effective,For a Business Intelligence project report ,Moderately dependent,To make more research and give me more solid sources,Yes,Yes,More research information 
86,Male,24-26,IT & BIS,Undergraduate,United Kingdom,Yes,Yes,To get more information ,Yes,Sometimes,No,Rarely,Yes,Moderately effective,When learning Coding,Moderately dependent,To make my work easier ,Yes,Yes,I do not know
87,Female,21-23,IT & BIS,Undergraduate,United Kingdom,Yes,Yes,For understand difficult topics  As a support for assignments,Yes,Often,Yes,Often,Depending on the assignment,Extremely effective,AI always helped me to understand theory part of my modules,Moderately dependent,As a help for my assignments,No,Yes,I do not know
88,Male,18-20,IT & BIS,Undergraduate,United Kingdom,Yes,Yes,To do brainstorming ,Yes,Often,Yes,Rarely,Yes,Very effective,"Like when I’m having some complicated lessons, I always try to use AI tools to summarize it for me or, simplify it for me ",Moderately dependent,Summarizing lessons,Yes,Yes,I do not know
89,Male,21-23,IT & BIS,Undergraduate,United Kingdom,Yes,Yes,i use it to be ahead in class and access more information ,Yes,Always,Yes,Often,Yes,Very effective,it helped me in understanding how to make my idea more innovative ,Moderately dependent,mostly for assignments and courseworks ,Yes,Yes,ehh make a smarter model more accessible and cheaper
